{"engine":"excel","names":[],"sheets":[{"cells":{"A1":{"value":{"type":"number","value":1e+21}},"A10":{"value":{"type":"number","value":1.7976931348623157e+308}},"A2":{"value":{"type":"number","value":1e-7}},"A3":{"value":{"type":"number","value":0.000001}},"A4":{"value":{"type":"number","value":0.30000000000000004}},"A5":{"value":{"type":"number","value":0}},"A6":{"value":{"type":"number","value":8}},"A7":{"value":{"type":"number","value":999999999999999900000}},"A8":{"value":{"type":"number","value":1.0000000000000003e+21}},"A9":{"value":{"type":"number","value":5e-324}}},"name":"N"}],"version":"1"}