{"engine":"sheets","names":[{"name":"TaxRate","ref":"Sheet2!B5"}],"sheets":[{"cells":{"A1":{"value":{"type":"number","value":100}},"A2":{"formula":"=1/0","value":{"error":"#DIV/0!","type":"error"}},"C1":{"formula":"={1,2;3,4}","value":{"type":"array","value":[[{"type":"number","value":1},{"type":"number","value":2}],[{"type":"number","value":3},{"type":"number","value":4}]]}}},"name":"Sheet1"},{"cells":{"A1":{"formula":"=Sheet1!A1*TaxRate","value":{"type":"number","value":8}},"B5":{"value":{"type":"number","value":0.08}}},"name":"Sheet2"}],"version":"1"}